{
  "$schema": "http://json-schema.org/draft-04/schema#",
  "description": "Resource Edge mapping definition",
  "type": "object",
  "properties": {
    "resourceMapping": {
      "$ref": "resourceMapping.json"
    },
    "fetchRemote": {
      "type": "boolean"
    },
    "bfNameSpace": {
      "type": "string",
      "description": "Bibframe resource name space"
    },
    "ldResourceDef": {
      "$ref": "ldResourceDef.json"
    },
    "bfResourceDef": {
      "$ref": "bfResourceDef.json"
    }
  }
}
