{
  "bfResourceDef": {
    "typeSet": "http://id.loc.gov/ontologies/bibframe/Instance"
  },
  "bfNameSpace": "http://id.loc.gov/ontologies/bibframe/instances/",
  "ldResourceDef": {
    "typeSet": "INSTANCE"
  },
  "resourceMapping": {
    "properties": [
      {
        "ldProperty": "DIMENSIONS",
        "bfProperty": "http://id.loc.gov/ontologies/bibframe/dimensions"
      },
      {
        "ldProperty": "STATEMENT_OF_RESPONSIBILITY",
        "bfProperty": "http://id.loc.gov/ontologies/bibframe/responsibilityStatement"
      }
    ],
    "outgoingEdges": [
      {
        "resourceMapping": {
          "properties": [
            {
              "ldProperty": "MAIN_TITLE",
              "bfProperty": "http://id.loc.gov/ontologies/bibframe/mainTitle"
            },
            {
              "ldProperty": "SUBTITLE",
              "bfProperty": "http://id.loc.gov/ontologies/bibframe/subtitle"
            }
          ],
          "label": [ "MAIN_TITLE", "SUBTITLE"]
        },
        "bfNameSpace": "http://id.loc.gov/sources/titles/",
        "ldResourceDef": {
          "typeSet": "TITLE",
          "predicate": "TITLE"
        },
        "bfResourceDef": {
          "typeSet": "http://id.loc.gov/ontologies/bibframe/Title",
          "predicate": "http://id.loc.gov/ontologies/bibframe/title"
        }
      },
      {
        "resourceMapping": {
          "properties": [
            {
              "ldProperty": "MAIN_TITLE",
              "bfProperty": "http://id.loc.gov/ontologies/bibframe/mainTitle"
            },
            {
              "ldProperty": "SUBTITLE",
              "bfProperty": "http://id.loc.gov/ontologies/bibframe/subtitle"
            }
          ],
          "label": [ "MAIN_TITLE", "SUBTITLE"]
        },
        "bfNameSpace": "http://id.loc.gov/sources/titles/",
        "ldResourceDef": {
          "typeSet": "VARIANT_TITLE",
          "predicate": "TITLE"
        },
        "bfResourceDef": {
          "typeSet": "http://id.loc.gov/ontologies/bibframe/VariantTitle",
          "predicate": "http://id.loc.gov/ontologies/bibframe/title"
        }
      }
    ],
    "incomingEdges": [
      {
        "resourceMapping": {
          "properties": [
            {
              "ldProperty": "LABEL",
              "bfProperty": "http://www.w3.org/2000/01/rdf-schema#label"
            }
          ]
        },
        "bfNameSpace": "http://id.loc.gov/ontologies/bibframe/works/",
        "ldResourceDef": {
          "typeSet": "WORK",
          "predicate": "INSTANTIATES"
        },
        "bfResourceDef": {
          "typeSet": "http://id.loc.gov/ontologies/bibframe/Work",
          "predicate": "http://id.loc.gov/ontologies/bibframe/instanceOf"
        }
      }
    ]
  }
}
