{
  "bfNameSpace": "http://id.loc.gov/resources/titles/",
  "ldResourceDef": {
    "typeSet": "TITLE",
    "predicate": "TITLE"
  },
  "bfResourceDef": {
    "typeSet": "http://id.loc.gov/ontologies/bibframe/Title",
    "predicate": "http://id.loc.gov/ontologies/bibframe/title"
  },
  "resourceMapping": {
    "properties": [
      {
        "ldProperty": "MAIN_TITLE",
        "bfProperty": "http://id.loc.gov/ontologies/bibframe/mainTitle"
      },
      {
        "ldProperty": "PART_NAME",
        "bfProperty": "http://id.loc.gov/ontologies/bibframe/partName"
      },
      {
        "ldProperty": "PART_NUMBER",
        "bfProperty": "http://id.loc.gov/ontologies/bibframe/partNumber"
      },
      {
        "ldProperty": "SUBTITLE",
        "bfProperty": "http://id.loc.gov/ontologies/bibframe/subtitle"
      },
      {
        "ldProperty": "NON_SORT_NUM",
        "bfProperty": "http://id.loc.gov/ontologies/bflc/nonSortNum"
      }
    ],
    "label": [
      "MAIN_TITLE",
      "SUBTITLE"
    ]
  }
}
